{
  "taskType": "safety.unsafe_image",
  "fixtureVersion": "1",
  "description": "Reference golden I/O for safety.unsafe_image",
  "input": {
    "assetRef": "file_golden_vision_001",
    "options": {}
  },
  "workerResult": {
    "schemaVersion": "1",
    "taskId": "tsk_golden_safety_unsafe_image",
    "status": "SUCCEEDED",
    "output": {
      "data": {
        "safe": true,
        "riskScore": 0.05,
        "categories": [],
        "reason": "Image appears safe."
      },
      "visionRuntimeClass": "safety_runtime"
    },
    "metrics": {
      "llmMs": 900,
      "visionMs": 900
    }
  },
  "minimumConfidenceMilli": 960
}
