{
  "taskType": "nlp.spam_fraud_classification",
  "fixtureVersion": "1",
  "description": "Reference golden I/O for nlp.spam_fraud_classification",
  "input": {
    "inlineText": "You won a prize. Send your password now.",
    "options": {}
  },
  "workerResult": {
    "schemaVersion": "1",
    "taskId": "tsk_golden_spam_fraud_001",
    "status": "SUCCEEDED",
    "output": {
      "data": {
        "label": "fraud",
        "confidence": 0.95,
        "signals": ["credential_request", "unsolicited_prize_claim"]
      }
    },
    "metrics": {"llmMs": 510}
  },
  "minimumConfidenceMilli": 960
}
