{
  "taskType": "safety.violence_detection",
  "fixtureVersion": "1",
  "description": "Reference golden I/O for safety.violence_detection",
  "input": {
    "assetRef": "file_golden_vision_001",
    "options": {}
  },
  "workerResult": {
    "schemaVersion": "1",
    "taskId": "tsk_golden_safety_violence_detection",
    "status": "SUCCEEDED",
    "output": {
      "data": {
        "violence": false,
        "riskScore": 0.04,
        "categories": [],
        "reason": "No violence detected."
      },
      "visionRuntimeClass": "safety_runtime"
    },
    "metrics": {
      "llmMs": 900,
      "visionMs": 900
    }
  },
  "minimumConfidenceMilli": 960
}
